{
  "word": "play-view",
  "summary": "PlayMaker's script editor in its read-only profile: a scene as Diana-format script pages under a quiet \"PlayMaker editor · read-only\" line. Offer it as the editor, read-only, not a replacement. Usually {row.text} on a row screen.",
  "since": "0.4",
  "rendering": "drawn",
  "component": "soma-play",
  "export": "mountPlayView",
  "placement": "row",
  "label": "text",
  "template": "play-view \"{row.$field}\"",
  "params": [
    {
      "name": "text",
      "in": "label",
      "required": true,
      "description": "The scene; usually {row.text} on a row screen"
    }
  ],
  "data": {
    "reads": "The text in its label.",
    "writes": "nothing"
  },
  "routes": [],
  "permissions": "Anyone who can see the screen.",
  "enforcement": "none",
  "runsOn": "browser",
  "tags": [
    "play",
    "script",
    "theatre",
    "writing",
    "editor",
    "read-only"
  ],
  "docs": "packages/soma-puppet-runtime/GRAMMAR-v0.10.md#3-play-view-is-the-editors-read-only-profile",
  "source": [
    "packages/soma-play/src/play-view.js",
    "packages/soma-play/src/script.js"
  ],
  "tests": [
    "packages/soma-play/test/script.test.js",
    "packages/soma-puppet-runtime/test/render-v04.test.js"
  ],
  "limits": [
    "The editing profile (PlayMaker's mark-layer editor) is not wrapped yet; with doc-import the writer edits in their Google Doc."
  ]
}
