{
  "word": "stage-read",
  "summary": "Reads a scene aloud line by line, a voice per character; highlights the line in a play-view of the same field.",
  "since": "0.4",
  "rendering": "drawn",
  "component": "soma-play",
  "export": "mountStageRead",
  "placement": "row",
  "label": "row-field",
  "template": "stage-read \"{row.$field}\"",
  "params": [
    {
      "name": "text",
      "in": "label",
      "required": true,
      "description": "Exactly one {row.field}"
    }
  ],
  "data": {
    "reads": "One field of the screen's row; the page sends only the row id and a line number.",
    "writes": "Spend counters and an audio cache."
  },
  "routes": [
    {
      "method": "POST",
      "path": "/api/app/:appId/stage-read",
      "who": "signed in reader of the row",
      "purpose": "Body { data, rowId, field, line }; answers audio/mpeg",
      "checks": [
        "signed in",
        "a stage-read of this field on a screen the reader can see",
        "the reader may read the row",
        "the line exists",
        "spend allowance"
      ]
    }
  ],
  "permissions": "Only a reader of the row; a row they may not read answers like a missing row.",
  "enforcement": "server",
  "cost": {
    "service": "ElevenLabs text to speech",
    "key": "ELEVENLABS_API_KEY (server only)",
    "allowance": "Characters per line, per person per day and per app per day, plus lines per person per day; cached lines are free"
  },
  "runsOn": "browser+server",
  "tags": [
    "play",
    "voice",
    "tts",
    "theatre",
    "audio"
  ],
  "limits": [
    "Five fixed voices chosen from the character name; no voice picker yet."
  ],
  "docs": "packages/soma-puppet-runtime/GRAMMAR-v0.4.md#stage-read-the-scene-read-aloud-a-voice-per-character",
  "source": [
    "packages/soma-play/src/stage-read.js",
    "packages/soma-play/src/script.js",
    "packages/soma-play/server/stage-read.js"
  ],
  "tests": [
    "packages/soma-play/test/stage-read.test.js",
    "packages/soma-puppet-runtime/test/v04.test.js"
  ]
}
