{
  "word": "toast",
  "summary": "An inline status line. Usually reached through the toast action on a hook instead.",
  "since": "0.1",
  "rendering": "drawn",
  "component": null,
  "placement": "any",
  "label": "text",
  "template": "toast \"Saved\"",
  "params": [
    {
      "name": "text",
      "in": "label",
      "required": true,
      "description": "The message"
    }
  ],
  "data": {
    "reads": "nothing",
    "writes": "nothing"
  },
  "routes": [],
  "permissions": "Anyone who can see the screen.",
  "enforcement": "none",
  "runsOn": "browser",
  "tags": [
    "feedback"
  ],
  "docs": "packages/soma-puppet-runtime/GRAMMAR-v0.1.md",
  "source": [
    "packages/soma-puppet-runtime/src/parser.js",
    "packages/soma-puppet-runtime/src/render.js"
  ],
  "tests": [
    "packages/soma-puppet-runtime/test/parser.test.js",
    "packages/soma-puppet-runtime/test/render.test.js"
  ]
}
